hash,time,message,keyword_buggy,human_buggy,fastread_buggy
80b10d7e,2017-04-21 16:24:06,adds central database registration method,0,,0
caa98768,2017-04-21 16:24:52,adds unittest for registerInCentralThermoDB,0,,0
96811b8d,2017-04-21 19:43:39,Added new atomTypeTests,0,,0
93a3d731,2017-04-22 10:19:51,Modified atomtypedatabase.py according to new atomTypes,0,,0
3f7db6b6,2017-04-22 14:27:40,adds unittest for rmgpy.rmg.input.thermoCentralDatabase,0,,0
1b013b55,2017-04-24 16:41:34,Add kekulize method to Molecule class,0,,0
7c0b3fca,2017-04-24 16:41:42,Add increment/decrement bond properties for Cb/Cbf,0,,0
af0fcf79,2017-04-24 16:41:44,Handle benzene bond modifications in GroupBond,0,,0
8e32fd4b,2017-04-24 16:41:47,Add `props` attribute to Group,0,,0
06a41050,2017-04-24 16:41:49,Redistribute electrons after changing a benzene bond,0,,0
7605a831,2017-04-24 16:41:52,Add unit tests for reacting benzene bonds to familyTest,0,,0
671a0d55,2017-04-24 16:41:55,Add atom id attribute and method to assign,0,,0
471eecc6,2017-04-24 16:41:57,Add isIdentical method for molecule comparison,0,,0
970db9d3,2017-04-24 16:41:59,Add unit tests for isIdentical,0,,0
bbe85199,2017-04-24 16:42:02,Add keepIsomorphic option for generateResonanceStructures,0,,0
84d56ec1,2017-04-24 16:42:05,Add unit test for keepIsomorphic option,0,,0
6d0ec736,2017-04-24 16:42:08,Allow 1 benzene bond for Cb atomtype,0,,0
e9399ffe,2017-04-24 16:42:11,Improve error handling for kekulization,1,,0
643c56ec,2017-04-25 17:48:15,Changed Fourier Fitting in Cantherm,0,,0
e69eb4c0,2017-04-26 10:36:57,Merge pull request #968 from ReactionMechanismGenerator/reactBenzene,0,,1
3be84623,2017-04-26 13:55:40,Update NASA Class Docstrings for Returning Thermo in J/mol The NASA class calls the NASAPolynomial methods  which return the thermo in J/mol or J/mol-K. However  the NASA Class claims erroneously that it returns the dimensionless versions.,0,,0
bc630351,2017-04-26 15:49:23,Tweaks to cantherm input processing to manage FreeRotors,0,,0
2152b513,2017-04-27 14:06:20,fix rotor management issue that removed rotors if fit != best,1,,0
26406dd0,2017-04-28 04:35:19,Added the CO_Disprop family to getReactionPairs in family.py,0,,0
edd10b00,2017-04-28 11:17:08,warning for when the Force Constant matrix is missing and there are rotors in the system,0,,0
0487aaa7,2017-04-28 13:56:46,Add writing of boundaryAtom to saveGroups method in families,0,,0
bdba7a33,2017-04-28 14:19:05,Merge pull request #1008 from ReactionMechanismGenerator/Update_Thermo_Docstrings,0,,1
2af1fc3e,2017-04-28 14:25:32,update resonance atom types,0,,0
4a160b01,2017-05-01 13:19:14,Add bug fix for postive charges in writing adjlists,1,,1
b1c2edc3,2017-05-02 12:20:47,Fix bug for writing solvation library entries,1,,1
b91ea41c,2017-05-03 09:30:53,Change Database.getEntriesToSave() to renumber indexes,0,,0
17730e9a,2017-05-03 09:33:23,Add script which machine writes the database,0,,0
5b20ef12,2017-05-03 15:10:39,Machine-write the kinetics families in test_database directory.,0,,0
35d3d7a8,2017-05-03 15:56:19,Add functional test to check maching-saving for a family,0,,0
4a93ea2c,2017-05-03 15:56:56,Add the remaining part of the docstring for diffModels.py,0,,0
e250e45d,2017-05-03 18:54:57,Merge pull request #928 from ReactionMechanismGenerator/deterministic_rxn_direction,0,,1
d8efa928,2017-05-04 12:31:31,Merge pull request #991 from ReactionMechanismGenerator/RemoveCanthermGeometry,0,,1
3120c2be,2017-05-14 18:22:58,added solvation database to testing database,0,,0
c10a6657,2017-05-15 11:49:49,Merge pull request #1012 from ReactionMechanismGenerator/COdisprop,0,,1
26510a52,2017-05-16 11:48:06,modularized adding kinetics to reactions in `cerm.enlarge`,0,,0
76165121,2017-05-17 16:53:57,add species label as smiles string if species.__str__ called,0,,0
792b6dd6,2017-05-18 15:27:26,Updated thermo test database to use longDistanceInteraction files,0,,0
6f548bb4,2017-05-18 16:33:23,make species string parsing from ckcsv more robust,0,,0
1d8a2985,2017-05-18 17:06:28,Merge pull request #1024 from ReactionMechanismGenerator/mech_analyzer,0,,1
db9680bd,2017-05-18 18:52:08,fix species string parsing typo,1,,0
be8325be,2017-05-18 19:18:15,Merge pull request #1025 from ReactionMechanismGenerator/mech_analyzer,0,,1
7adab32b,2017-05-19 11:11:46,added sig. figs. to A factors output by RMG,0,,0
a933b631,2017-05-22 22:48:32,In Cantherm  ensure that the same Cartesian coordinate system is used for both the species's geometry and Hessian  to prevent erroneous hindered/free rotor projection.,0,,0
524605ec,2017-05-25 00:37:45,added changeBaseEntropy method for NASA thermo class,0,,0
ac110fb7,2017-05-28 23:09:11,adds satisfyRegistrationRequirement to tcdi,0,,0
ce864820,2017-05-28 23:10:28,create connectToTestCentralDatabase,0,,0
b5c47286,2017-05-28 23:33:45,add unittests for satisfyRegistrationRequirements,0,,0
36d55522,2017-05-29 01:43:37,Merge pull request #1030 from ReactionMechanismGenerator/thermo_db,0,,1
077d9ab4,2017-05-30 14:43:26,Fixes to support use of multiple reactors,1,,0
4338c6b9,2017-05-30 17:39:32,Add props attribute to Atom,0,,0
9eabf9bf,2017-05-30 17:47:40,Add props attribute to GroupAtom,0,,0
22bf1c61,2017-05-30 20:26:39,Rename COPYING.txt to LICENSE.txt Changed so that github will recognize the file,0,,0
40789ff6,2017-05-30 20:46:25,Update Copywrite Dates,0,,0
7f71b2d6,2017-05-31 11:18:33,Incude ICCK_Demo ipython script in ipython folder,0,,0
773cc853,2017-05-31 12:26:51,Merge pull request #994 from ReactionMechanismGenerator/transportSearch,0,,1
30f33963,2017-05-31 13:54:59,Merge pull request #1033 from ReactionMechanismGenerator/ICCK_Demo,0,,1
37cdcfc7,2017-05-31 14:08:51,allow pickling of isotopic elements in molecules,0,,0
a9dead48,2017-05-31 14:58:01,Added methods for working with isotopes,0,,0
7da2c0e8,2017-05-31 15:10:59,correct Entropy of isotopomers,0,,0
7a4c0b6f,2017-05-31 15:13:17,Ensure correct reaction direction for similar reactions,0,,0
515e4937,2017-05-31 23:38:48,remove degeneracy calculations from __generateReactions,0,,0
d63b998a,2017-05-31 23:49:28,refactor reaction.isIsomorphic and allow identical checking,0,,0
5d217158,2017-06-01 00:25:42,undo work-in-progress test for rmgTest,0,,0
8e358b48,2017-06-01 00:28:18,make default resonance structures isomorphic,0,,0
71c56a96,2017-06-01 00:43:20,separate degeneracy calculation for rxn.reverse objects,0,,0
f9586e1d,2017-06-01 01:03:44,Allow input of species' objects to __generateReactions(products),0,,0
e647ca99,2017-06-01 01:05:36,small type & name changes in saving training reactions,0,,0
f4b7a745,2017-06-01 02:01:38,updated degeneracy algorithm,0,,0
77745266,2017-06-01 02:05:43,method to ensure species list has all different IDs,0,,0
83e7c64c,2017-06-01 02:10:30,ensure that reverse reactions have correct degeneracies,0,,0
70db6220,2017-06-01 02:20:36,reduced degeneracy for identical reactants,0,,0
bc0f5d14,2017-06-01 02:28:17,get react module to work on Species  not molecules,0,,0
7ed8a6c4,2017-06-01 02:34:10,updated the calculateDegeneracy method,0,,0
883aaddd,2017-06-01 03:15:06,reset database at end of test methods,0,,0
73b00de0,2017-06-01 03:15:53,Allow checkForExistingReactions to track multiple TS,0,,0
c49650c5,2017-06-01 15:21:09,Add method to identify ring membership of atoms,0,,0
10f7e723,2017-06-01 15:22:34,Add adjlist support for props attribute of Group,0,,0
d7004751,2017-06-01 15:44:07,Allow database-test to make sample atoms using nitrogen atomTypes,0,,0
d8137424,2017-06-01 16:39:06,Add support for props in equivalent and isSpecificCaseOf,0,,0
5219087f,2017-06-01 18:01:18,Identify ring membership after molecule creation,0,,0
35885830,2017-06-01 18:02:19,Add unit test for subgraph isomorphism with inRing property,0,,0
b157b0a5,2017-06-02 15:34:51,Add one fringe case test to databaseTest,0,,0
5e66b3b3,2017-06-02 16:59:12,Merge pull request #1038 from ReactionMechanismGenerator/databaseTestFix,0,,1
db9232a2,2017-06-02 18:18:27,Merge pull request #1016 from ReactionMechanismGenerator/entrySaving,0,,1
58280fae,2017-06-03 15:11:57,turn off dynamics if not used,0,,0
f5df3952,2017-06-04 18:13:24,addition of a getSumOfStates function for FreeRotors based on Forst 1995,0,,0
71f03511,2017-06-04 18:13:59,Unit Tests for FreeRotors,0,,0
d48b916c,2017-06-04 18:15:09,unit test to check that the Gaussian Log File Error is raised when appropriate,1,,0
586920af,2017-06-05 13:48:52,make new simulate parameters option in addition to the input parameters (+4 squashed commits) Squashed commits: [1dda62c] Fix to catch special case when totalDivAccumNums is empty [30ce661] fix indentation error [ac9e7b5] add statement to append pdep objects to objectsToEnlarge in main [134a660] added reversibility issue fixes used in simple reactor to liquid reactor (+1 squashed commit) Squashed commits: [50af486] fix issue with reverse reaction rate being added instead of subtracted (+2 squashed commits) Squashed commits: [b42bcbd] differentiation between forward and reverse reaction rates in production and consumption [9d99df6] further handling of the production or consumption = 0 case (+1 squashed commit) Squashed commits: [9889abb] Fixed  reverse reaction bug causing inconsistent calculation of edge species formation rates,1,,0
97ee50f8,2017-06-05 16:29:33,Added a raise DatabaseError to thermo.py to avoid infinite looping incase a thermo pointer is corrupt,0,,0
cdffa142,2017-06-05 16:29:33,Added a raise DatabaseError to thermo.py to avoid infinite looping in case a thermo pointer is corrupt,0,,0
1c8f8d9b,2017-06-06 17:38:12,Add bugfix for alignment of species when displaying reactions,0,,0
0775701f,2017-06-07 15:01:37,Add try/except for resetting signal after calling lpsolve,0,,0
19b21d37,2017-06-07 16:43:29,Merge pull request #1041 from ReactionMechanismGenerator/reactionDrawingFix,0,,1
94cfe310,2017-06-08 12:24:27,Add argparse function to model reduction script for command line control Add control of logging level from the command line,0,,0
223c3177,2017-06-10 16:41:58,Always use scaled harmonic oscillator (HO) frequencies for calculating ZPE in Cantherm  rather than projected frequencies when hindered rotors are included.  Remove deprecated getZPEfromfrequencies function.,0,,0
f56e9f58,2017-06-10 16:44:13,Adding Benzyl radical hindered rotor example,0,,0
df4dc23e,2017-06-12 11:58:05,Update Documentation for rmgpy/tools/diff_models.py,0,,0
75111a5c,2017-06-12 15:49:47,Add Command Line Options for Controlling diffModels.py Output,0,,0
9cc3ad2a,2017-06-13 07:43:26,change default kinetics estimator to rate rules,0,,0
1bd44a9d,2017-06-13 13:51:35,add testing for degneracy and symmetry,0,,0
88d8dd50,2017-06-14 11:09:35,Add minimal_surface example (ethane pyrolysis),0,,0
9292a790,2017-06-14 15:34:18,adapt minimal_surface example,0,,0
25c3de82,2017-06-15 09:49:57,Added the charge attribute to atomTypes,0,,0
aeec5013,2017-06-16 11:25:31,adds decorator for tests need authentication to access resource online,0,,0
9c3a5dd4,2017-06-16 11:26:13,reorganize test modes in makefile,0,,0
f24c7cc3,2017-06-16 12:12:20,Merge pull request #1040 from ReactionMechanismGenerator/canthermRotors,0,,1
99226147,2017-06-16 12:39:03,make travis test to run `make test-all`,0,,0
bd5bf380,2017-06-16 13:20:10,Merge pull request #1056 from ReactionMechanismGenerator/auth_test,0,,1
93aee205,2017-06-16 16:47:19,Merge pull request #1036 from ReactionMechanismGenerator/UpdateCopyright,0,,1
cca849e0,2017-06-19 11:19:02,Output the Euclidian distance in the chem_annotated.inp,0,,0
5d7182c9,2017-06-20 11:08:55,Modification of the minimal_surface example to effectively test the dynamicsTimeScale as well as the surface algorithm,0,,0
2f9e2670,2017-06-20 11:54:37,staged model generation example,0,,0
4aa01d37,2017-06-20 12:33:10,thermodynamic filtering example based on the minimal example,0,,0
e4271070,2017-06-20 13:36:04,dynamics criterion example based on the minimal example,0,,0
89bd5590,2017-06-20 13:47:30,adjust to new naming convention,0,,0
5d092c2b,2017-06-21 13:53:39,Fix group additivity calls so that they can access the root template properly,1,,0
cc46464f,2017-06-21 15:40:39,make cantherm chemkin output file runnable,0,,0
1fbf8fb7,2017-06-21 21:42:06,make cantherm comment out excess reactions,0,,0
ebc32fd3,2017-06-23 09:56:02,Be more specific about how small the diffusion limited rate should be.,0,,0
5533691f,2017-06-23 10:02:17,function header fixes,1,,0
a638c69a,2017-06-23 10:25:33,simplify treeDistances setting,0,,0
908ae442,2017-06-23 10:38:26,Merge pull request #980 from ReactionMechanismGenerator/mol_order_from_library,0,,1
0cc4fcd1,2017-06-23 11:04:36,Report minimum euclidian distance is 0 if you get a direct hit.,0,,0
d48f0a61,2017-06-23 11:47:31,documentation of symmetry updated,0,,0
91519a95,2017-06-23 12:03:25,use string dictionary for treeDistances,0,,0
a4a56926,2017-06-23 12:03:52,clean up loops and added comments,0,,0
e4213fa8,2017-06-23 12:42:13,Change the maximum number of terms we use to fit hinderedRotors,0,,0
23b3a471,2017-06-23 13:04:43,Merge pull request #1043 from ReactionMechanismGenerator/Model_Reduction_Argparse,0,,1
f6948e1c,2017-06-23 13:05:52,Add warnings when adding more terms for Fourier fits of hindered rotors,0,,0
c3dd7047,2017-06-23 13:11:39,Add diffModels example,0,,0
8a9e658f,2017-06-23 13:46:31,Merge pull request #1006 from ReactionMechanismGenerator/torsion_Lai,0,,1
8ca658ad,2017-06-23 14:22:11,clean up and renaming,0,,0
8738f440,2017-06-23 14:26:57,Fix bug where some species did not have pictures saved in diffModels tool,1,,1
cef213f3,2017-06-23 14:32:36,Merge pull request #1014 from ReactionMechanismGenerator/symmetry_corrections,0,,1
c6441ce2,2017-06-23 15:06:19,updated meta.yaml cython version,0,,0
362cb36f,2017-06-23 15:11:03,Merge pull request #1048 from ReactionMechanismGenerator/diffModels_Customize_Output,0,,1
1c426b05,2017-06-23 15:17:36,Merge pull request #871 from ReactionMechanismGenerator/longDistanceInteraction_rewrite,0,,1
e117febe,2017-06-23 16:44:04,Merge pull request #1055 from ReactionMechanismGenerator/degeneracy,0,,1
eef8b286,2017-06-23 16:50:20,Merge pull request #1059 from ReactionMechanismGenerator/DynamicsCriterion,0,,1
41f630b8,2017-06-25 07:03:50,Update isomer in PDep exploration,0,,0
4bd520ab,2017-06-26 17:34:17,remove special case for atom symmetry,0,,0
74591956,2017-06-26 17:36:27,improve error checking for symmetry estimation with resonance hybrids,1,,0
82e17444,2017-06-27 18:45:28,allow cantera output to use RMG names,0,,0
82881617,2017-06-27 20:31:53,Add indexing to args.output_directory to return a string,0,,0
efe5544b,2017-06-28 00:16:23,made species.toCantera default to using RMG labels,0,,0
4d86b7bd,2017-06-28 10:31:12,added warning to change folder name during installation,0,,0
88939cff,2017-06-28 11:17:51,Merge pull request #1069 from ReactionMechanismGenerator/developer_documentation_update,0,,0
85d0a833,2017-06-28 14:20:03,added documentation for cantherm chemkin output file,0,,0
666bc291,2017-06-28 14:43:15,two canterm examples output species and reactions,0,,0
ab06fc71,2017-06-28 15:57:35,modified documentation about pdep output,0,,0
500a5164,2017-06-29 15:32:24,added option to comment out chemkin kinetics entry,0,,0
87dd5ea5,2017-06-29 17:31:55,added isotope script documentation,0,,0
aa8e2387,2017-06-30 10:39:49,Added a specificCollider attribute to the Reaction class,0,,0
3489fc7f,2017-06-30 10:42:23,Added the ability to read specificCollider from a library reaction,0,,0
2e7bfbd4,2017-06-30 10:55:04,Reading\writing Chemkin files with a specificCollider,0,,0
0ebc173a,2017-06-30 16:48:09,ensure database test checks all all atom labels,0,,0
4e0fb0af,2017-07-01 20:40:43,Test that a specificCollider can be read,0,,0
7f31cc52,2017-07-02 14:25:29,Reorganized the PDep documentation a bit.,0,,0
491cbb45,2017-07-03 06:47:29,Handeling specificCollider attribute,0,,0
e100a7eb,2017-07-03 16:26:29,Enable model.py to handel specificCollider as a model Species,0,,0
d545d922,2017-07-06 13:53:44,allow loaded TemplateReactions to store degeneracy and templates,0,,0
a558e7c2,2017-07-06 13:59:39,extend unittest to read the written chemkin file,0,,0
b237abe6,2017-07-06 22:50:33,output template for exact matches to training reactions,0,,0
3e4f2bf3,2017-07-07 09:55:26,Modified simple.pyx solver to account for specificCollider,0,,0
ea266086,2017-07-07 13:42:01,Added a testSpecificColliderModel,0,,0
d00ebe90,2017-07-10 12:28:54,Add support in reaction group additivity for ArrheniusEP also switch degeneracy adjustments to use changeRate,0,,0
332ae28f,2017-07-10 14:24:46,Merge pull request #941 from ReactionMechanismGenerator/nodalDistances,0,,1
7cb7b0ae,2017-07-10 14:29:06,expand rxn.isIsomorphic to optionally check species labels,0,,0
1d702533,2017-07-10 16:43:55,allow all resonance structures to be used in deflating,0,,0
07e0c2d8,2017-07-10 18:17:41,Adding an Exception to retrieveNewSpecies(),0,,0
d038f39e,2017-07-11 11:22:47,make it possible to run the superminimal example as eg0 in the makefile:  make eg0.  Since profiling is pretty useless on a such a short job and the intent of this example is speed profiling and html generation have been removed.,0,,0
956c3a8a,2017-07-11 11:23:24,Adding superminimal example for fast (~20 sec) testing that RMG runs properly  based on stoichiometric H2 oxidation at 1000 K,0,,0
f0375209,2017-07-11 13:51:31,Add terminateAtMaxObjects option causes RMG simulations to terminate when the maximum number of objects it can collect in a simulation has been reached,0,,0
7be33706,2017-07-11 14:05:37,new function getLayeringIndices,0,,0
8cae0ad2,2017-07-11 15:03:38,Added info of reaction type to PDep network files,0,,0
7a8ff980,2017-07-11 15:05:28,remove line breaks for chemkin kinetics comment parsing,0,,0
9ebbc7c4,2017-07-11 15:24:14,Adapt the minimal_staged example,0,,0
f7f1fee7,2017-07-12 11:34:02,Removed logging.debug message in reaction.py __setDegeneracy(),0,,0
45a96d28,2017-07-12 16:54:37,Add code to set walltime from commandline flag Walltime flag was implemented in rmg.py  but was not utilized in rmgpy.rmg.main.py,0,,0
6388d45a,2017-07-12 16:59:17,Toluene Free and Hindered Rotor Example Added Gaussian logs for Toluene and separate hindered and free rotor input and species files for Toluene allows both a hindered rotor and free rotor example to be run,0,,0
1ae3a89b,2017-07-13 18:35:57,Added a `comment` attribute to Reaction class,0,,0
619c2cfd,2017-07-13 22:10:06,Added kinetics documentation,0,,0
517d45b5,2017-07-14 15:02:16,added atom energies for m06-2x model chemistry,0,,0
8ab3cdfb,2017-07-14 15:51:42,Added M06-2X/cc-pVTZ to Cantherm's documentation,0,,0
75c6795e,2017-07-14 16:03:32,Changes to fixBarrierHeight,0,,0
998043e7,2017-07-14 16:19:01,adds detailed docstring for how we get atom energies,0,,0
869a9e6a,2017-07-17 12:00:58,added unit test for Reaction.fixBarrierHeight,0,,0
b87be952,2017-07-17 14:55:16,kill ssh-agent after everything's done,0,,0
d7f9a573,2017-07-17 16:32:49,Merge pull request #1092 from ReactionMechanismGenerator/ssh_agent,0,,1
8fbf8858,2017-07-17 17:07:37,Merge pull request #1084 from ReactionMechanismGenerator/collider,0,,1
1fc47ef5,2017-07-17 19:41:00,Merge pull request #1088 from ReactionMechanismGenerator/m06,0,,1
75524b19,2017-07-17 20:43:13,Merge pull request #1080 from ReactionMechanismGenerator/superminimal,0,,1
68f16927,2017-07-18 10:30:18,Merge pull request #1085 from ReactionMechanismGenerator/FixWalltimeFlag,0,,1
c683724a,2017-07-18 11:35:38,added parameters to commented ex.,0,,0
388060d3,2017-07-18 11:50:23,prevent overwriting of existing libraries,0,,0
8d4e48c9,2017-07-18 14:33:46,add new line to nodal distance comments,0,,0
0e1e62ed,2017-07-18 15:26:42,deletes the Euclidean distance comment during kinetics parsing to make the string ready for template evaluation,0,,0
f439bc61,2017-07-18 16:35:02,minor: correction to atomic number format for N in qchem.py,0,,0
b87b3f0f,2017-07-18 19:02:10,move rate rule name in entry.data.comment,0,,0
d0697a67,2017-07-18 21:51:41,added method from Arrhenius to ArrheniusEP,0,,0
770c02da,2017-07-18 21:57:50,convert all Arrhenius rate rules to ArrheniusEP,0,,0
8a35d30b,2017-07-18 22:05:11,refactored addKineticsFromTrainingSet to use toArrheniusEP,0,,0
c2dcf9d7,2017-07-19 16:26:19,removes unused specificColliderEfficiencies variable from simple.pyx,0,,0
cd77fbbf,2017-07-20 11:44:42,added option to set alpha in toArrheniusEP,0,,0
ac97e2b1,2017-07-20 12:15:38,Add options for seed generation,0,,0
89e4d439,2017-07-20 13:12:37,Corrected ArrheniusEP documentation,0,,0
97db40c5,2017-07-23 16:17:37,improve error message for quantity.py,1,,0
26178298,2017-07-23 18:18:33,get resetting degeneracy to fix kinetics comments,1,,0
21ecb2b6,2017-07-23 20:00:53,moved RMG exception class to specific file,0,,0
04e84a00,2017-07-24 14:27:20,Fixed two example files and a bug in statmech.py,1,,0
31536b8a,2017-07-26 14:50:18,remove saving failsafe,0,,0
a66a1e18,2017-07-26 14:53:50,create directories only when needed,0,,0
605dae77,2017-07-26 15:48:24,avoid smiles parsing error,1,,0
e128e702,2017-07-26 15:49:46,delete the old seed folder if present the first time through,0,,0
e9228d50,2017-07-26 15:50:22,test seed mechanism file generation,0,,0
7f78be6d,2017-07-27 10:26:04,remove duplicate getMoleculeTuple method,0,,0
6e8e3caf,2017-07-27 11:57:48,removed commented out code,0,,0
9194e200,2017-07-27 13:39:10,added repr function to TemplateRxn to show family & template,0,,0
e0c79f5b,2017-07-27 17:02:52,cimport tweak,0,,0
5900b0b7,2017-07-28 13:03:34,fix referencing issue,1,,1
1fb578b3,2017-07-28 13:37:47,compound example,0,,0
49823d9e,2017-07-28 14:08:45,Surface Tracking Variables and Tolerances Added,0,,0
eca0f3da,2017-07-28 14:10:34,New function maxIndUnderSurfaceLayeringConstraint,0,,0
5386a7db,2017-07-28 14:11:45,movement to the initialize_surface function,0,,0
35af0c9e,2017-07-28 14:19:18,fixing indexing and naming errors,1,,0
66532720,2017-07-28 14:21:36,fixes for issues with adding species/reactions to surface,1,,0
1c39bc1e,2017-07-28 14:22:52,surface function tests,0,,0
6a1b6f62,2017-07-28 14:24:45,Cythonization and indexing fixes,1,,0
d813d4aa,2017-07-28 14:28:52,Fixes for reaction movement,1,,0
7ecea5a8,2017-07-28 14:30:01,adds a test for addReactionToSurface,0,,0
ed62aab2,2017-07-28 14:33:25,surface calculations made sequential,0,,0
b1f208c5,2017-07-28 14:59:39,automatic seed mechanism generation on simulate call termination,0,,0
f9a8aab3,2017-07-28 15:00:45,added name to options block,0,,0
44908c9b,2017-07-28 15:02:55,change labels back,0,,0
2cd013ba,2017-07-28 15:17:53,creation and application of Reaction.toLabeledStr,0,,0
16cfa44c,2017-07-31 16:19:56,pdep fix,1,,1
2e91bf15,2017-07-31 18:02:38,Rephrased exception class descriptions.,0,,0
ebcbc257,2017-07-31 23:27:21,Convert a print statement to a logging.debug,0,,0
a2e2f28c,2017-08-01 15:03:35,remove tabs from main.py,0,,0
0faa4f8b,2017-08-02 09:29:37,fix issue with not including options block,1,,1
ecea505a,2017-08-02 09:32:02,make the seed appear in the output directory,0,,0
f3834eb9,2017-08-02 09:41:56,correct naming mistake,0,,0
66ba6ca8,2017-08-02 14:15:16,Add getAllEdges method to Graph,0,,0
c015cef1,2017-08-02 14:28:41,Add new unit tests to graphTest,0,,0
e0376272,2017-08-02 15:54:47,Replace algorithm for getSmallestSetOfSmallestRings,0,,0
f20ebad5,2017-08-02 15:56:56,Add method to retrieve set of relevant cycles,0,,0
84dae4a1,2017-08-03 09:08:43,fix windows seed generation,1,,1
82d23b93,2017-08-03 12:19:37,transfer the entry label attribute to the thermo object,0,,0
e5c3e4d7,2017-08-03 12:20:26,if not already named try to use thermo label,0,,0
d8d14a24,2017-08-03 14:03:58,Sort cycle vertices after ring perception,0,,0
dfe55ade,2017-08-03 15:15:29,add label attribute,0,,0
d12e58b5,2017-08-03 15:15:36,adapt test,0,,0
e3ed455c,2017-08-03 15:30:14,Add unit tests for ring perception,0,,0
be7cda77,2017-08-03 17:21:19,Use getRelevantCycles for aromaticity perception,0,,0
a9512904,2017-08-03 17:22:56,Sort lists during Clar optimization,0,,0
eb739fb2,2017-08-03 17:41:01,Use getRelevantCycles for checking isAromatic,0,,0
b5a1365e,2017-08-03 17:54:03,fix sensitivity analysis,1,,1
2f1b3b39,2017-08-04 13:54:46,Addition of frequency  geometry  and zero-point energy reading from Molpro output files,0,,0
0dceda16,2017-08-04 13:55:31,Allows iodine species to be read in from Gaussian log files,0,,0
c5337a5e,2017-08-04 13:56:10,Adds the spin orbital correction for iodine as well as an iodine specific CCSD method,0,,0
1e081516,2017-08-04 15:06:50,extend docstring for Atom  Bond  Molecule,0,,0
2ca9bdf6,2017-08-04 17:56:22,convert Molecule.fingerprint to a property,0,,0
b176b206,2017-08-07 12:00:30,Decrease grain size to keep collision tensor manageable,0,,0
89b9c2ca,2017-08-07 14:48:54,add codecov to report coverage change,0,,0
e1aebf90,2017-08-07 15:55:06,Merge pull request #1133 from ReactionMechanismGenerator/codecov,0,,1
5180a6a9,2017-08-07 16:22:04,added toleranceThermoKeepSpeciesInEdge,0,,0
fe004ed9,2017-08-07 16:23:55,initiate thermodynamic filtering while species being added to edge,0,,0
98562969,2017-08-07 18:41:02,Do not get coverage of functional tests,0,,0
437ca05c,2017-08-07 18:41:52,label functional tests with attribute 'functional',0,,0
5785bc18,2017-08-08 19:22:42,Add pyrdl to environment files and meta.yaml,0,,0
c828d2ce,2017-08-09 11:28:04,Merge pull request #1126 from ReactionMechanismGenerator/useThermoLibraryNames,0,,1
7c0df3d3,2017-08-09 11:38:13,Fix bug with handling non-aromatic resonance structures,1,,1
d43e2446,2017-08-09 15:10:07,test collision matrix memory fix,1,,1
e32da33d,2017-08-09 16:50:26,print species dictionary with cantherm job,0,,0
065a6faf,2017-08-09 16:56:56,Update dependencies and installation by source in documentation,0,,0
1f93534c,2017-08-10 15:50:51,Update the input file documentation,0,,0
641d2528,2017-08-10 16:24:20,generate edge seeds,0,,0
84fc920e,2017-08-11 10:22:49,added handling for lists of objects returned from simulate,0,,0
